<?xml version="1.0" encoding="UTF-8" ?>
<!DOCTYPE veterinary_clinic SYSTEM "D:\УНИ\5 - Пети семестър\XML\XML\.idea\Homework 1\VeterinaryClinic.dtd">

<veterinary_clinic>
    <staffs>
        <staff id="S005">
            <name_s>Маргарита</name_s>
            <last_name_s>Илиева</last_name_s>
            <phone_number_s>0881234511</phone_number_s>
            <position>Хирург</position>
            <salary>5000</salary>
            <email_s>m.ilieva@gmail.com</email_s>
        </staff>
    </staffs>
    <manipulations>
        <manipulation anesthesia="with">
            <name_m>Кастрация</name_m>
            <price>120</price>
            <duration>60</duration>
        </manipulation>
    </manipulations>
    <patients>
        <patient no_microchip="MNO0983022"
                 presence_of_castration="NO">
            <name_p>Спайк</name_p>
            <type>Куче</type>
            <breed>Английски булдог</breed>
            <gender>М</gender>
            <age>2</age>
            <weight>21</weight>
        </patient>
    </patients>
    <owners>
        <owner id="O15821">
            <name_o>Диана</name_o>
            <last_name_o>Георгиева</last_name_o>
            <phone_number_o>0881233577</phone_number_o>
            <region>София</region>
            <email_o>d.georgieva@gmail.com</email_o>
        </owner>
    </owners>
</veterinary_clinic>




